"id","authors","year","title","journal","volume","issue","pages","rayyan","class","pmcid","accession_num","abstract","url","doi"
"Knott2018bank.018","C. S. Knott, J. Panter, L. Foley and D. Ogilvie",2018,"Changes in the mode of travel to work and the severity of depressive symptoms: a longitudinal analysis of UK Biobank","Prev Med",112,NA,"61-69","RAYYAN-INCLUSION: {""Katie""=>true, ""Benjamin""=>true} | 2labels ukbo RAYYAN-INCLUSION: {""Katie""=>""Included"", ""Benjamin""=>""Included""} | 2labels epi","epi","PMC5999356","29604327","Although commuting provides an opportunity for incorporating physical activity into daily routines, little is known about the effect of active commuting upon depressive symptoms. This study aimed to determine whether changes in commute mode are associated with differences in the severity of depressive symptoms in working adults. Commuters were selected from the UK Biobank cohort if they completed >/=2 assessment centre visits between 2006 and 2016. Modes of travel to work were self-reported at each visit. Participants were categorised as 'inactive' (car only) or 'active' commuters (any other mode(s), including walking, cycling and public transport). Transitions between categories were defined between pairs of visits. The severity of depressive symptoms was defined using the two-item Patient Health Questionnaire (PHQ-2). Scores were derived between zero and six. Higher values indicate more severe symptoms. Separate analyses were conducted in commuters who were asymptomatic (zero score) and symptomatic (non-zero score) at baseline. The analytical sample comprised 5474 participants aged 40-75 at baseline with a mean follow-up of 4.65years. Asymptomatic commuters who transitioned from inactive to active commuting reported less severe symptoms at follow-up than those who remained inactive (beta -0.10, 95% CI [-0.20, 0.00]; N=3145). A similar but non-significant relationship is evident among commuters with pre-existing symptoms (beta -0.60, 95% CI [-1.27, 0.08]; N=1078). After adjusting for transition category, longer commutes at baseline were associated with worse depressive symptoms at follow-up among symptomatic participants. Shifting from exclusive car use towards more active commuting may help prevent and attenuate depressive symptoms in working adults.","https://www.ncbi.nlm.nih.gov/pubmed/29604327","10.1016/j.ypmed.2018.03.018"
"Smith2019bank.024","L. Smith, J. Panter and D. Ogilvie",2019,"Characteristics of the environment and physical activity in midlife: Findings from UK Biobank","Prev Med",118,NA,"150-158","RAYYAN-INCLUSION: {""Katie""=>true, ""Benjamin""=>true} | 2labels ukbo RAYYAN-INCLUSION: {""Katie""=>""Included"", ""Benjamin""=>""Included""} | 2labels epi","epi","PMC6344227","30367974","Characteristics of the environment influence health and may promote physical activity. We explored the associations between neighborhood environmental characteristics grouped within five facets (spaces for physical activity, walkability, disturbance, natural environment, and the sociodemographic environment) and objective ('recorded') and self-reported ('reported') physical activity in adults from UK Biobank. Recorded activity was assessed using wrist-worn accelerometers (2013-2015, n=65,967) and time spent in moderate-to-vigorous physical activity (MVPA), walking, and walking for pleasure was self-reported (2006-2010, n=337,822). Associations were assessed using linear and multinomial logistic regression models and data were analyzed in 2017. We found participants living in areas with higher concentrations of air pollution recorded and reported lower levels of physical activity and those in rural areas and more walkable areas had higher levels of both recorded and reported activity. Some associations varied according to the specificity of the outcome, for example, those living in the most deprived areas were less likely to record higher levels of MVPA (upper tertile: RRR: 0.80 95% CI: 0.74, 0.86) but were more likely to report higher levels of walking (upper tertile: RRR: 1.09, 95% CI: 1.06, 1.13). Environmental characteristics have the potential to contribute to different physical activities but interventions which focus on a single environmental attribute or physical activity outcome may not have the greatest benefits.","https://www.ncbi.nlm.nih.gov/pubmed/30367974","10.1016/j.ypmed.2018.10.024"
"Ingel2015tudy75-1","A. Ganna and E. Ingelsson",2015,"5 year mortality predictors in 498,103 UK Biobank participants: a prospective population-based study","Lancet",386,"9993","533-40","RAYYAN-INCLUSION: {""Katie""=>true, ""Benjamin""=>true} | 2labels ukbo RAYYAN-INCLUSION: {""Katie""=>""Included"", ""Benjamin""=>""Included""} | 2labels epi","epi",NA,"26049253","BACKGROUND: To our knowledge, a systematic comparison of predictors of mortality in middle-aged to elderly individuals has not yet been done. We investigated predictors of mortality in UK Biobank participants during a 5 year period. We aimed to investigate the associations between most of the available measurements and 5 year all-cause and cause-specific mortality, and to develop and validate a prediction score for 5 year mortality using only self-reported information. METHODS: Participants were enrolled in the UK Biobank from April, 2007, to July, 2010, from 21 assessment centres across England, Wales, and Scotland with standardised procedures. In this prospective population-based study, we assessed sex-specific associations of 655 measurements of demographics, health, and lifestyle with all-cause mortality and six cause-specific mortality categories in UK Biobank participants using the Cox proportional hazard model. We excluded variables that were missing in more than 80% of the participants and all cardiorespiratory fitness test measurements because summary data were not available. Validation of the prediction score was done in participants enrolled at the Scottish centres. UK life tables and census information were used to calibrate the score to the overall UK population. FINDINGS: About 500,000 participants were included in the UK Biobank. We excluded participants with more than 80% variables missing (n=746). Of 498,103 UK Biobank participants included (54% of whom were women) aged 37-73 years, 8532 (39% of whom were women) died during a median follow-up of 4.9 years (IQR 4.33-5.22). Self-reported health (C-index including age 0.74 [95% CI 0.73-0.75]) was the strongest predictor of all-cause mortality in men and a previous cancer diagnosis (0.73 [0.72-0.74]) was the strongest predictor of all-cause mortality in women. When excluding individuals with major diseases or disorders (Charlson comorbidity index >0; n=355 043), measures of smoking habits were the strongest predictors of all-cause mortality. The prognostic score including 13 self-reported predictors for men and 11 for women achieved good discrimination (0.80 [0.77-0.83] for men and 0.79 [0.76-0.83] for women) and significantly outperformed the Charlson comorbidity index (p<0.0001 in men and p=0.0007 in women). A dedicated website allows the interactive exploration of all results along with calculation of individual risk through an online questionnaire. INTERPRETATION: Measures that can simply be obtained by questionnaires and without physical examination were the strongest predictors of all-cause mortality in the UK Biobank population. The prediction score we have developed accurately predicts 5 year all-cause mortality and can be used by individuals to improve health awareness, and by health professionals and organisations to identify high-risk individuals and guide public policy. FUNDING: Knut and Alice Wallenberg Foundation and the Swedish Research Council.","https://www.ncbi.nlm.nih.gov/pubmed/26049253","10.1016/S0140-6736(15)60175-1"
"Cummi2016bank53-X","E. Flint and S. Cummins",2016,"Active commuting and obesity in mid-life: cross-sectional, observational evidence from UK Biobank","Lancet Diabetes Endocrinol",4,"5","420-35","RAYYAN-INCLUSION: {""Katie""=>true, ""Benjamin""=>true} RAYYAN-INCLUSION: {""Katie""=>""Included"", ""Benjamin""=>""Included""} | 1labels epi","epi",NA,"26995106","BACKGROUND: Physical inactivity is a leading cause of obesity and premature mortality. We aimed to examine the relation between active commuting and obesity in mid-life using objectively measured anthropometric data from UK Biobank. METHODS: Cross-sectional, observational data from UK Biobank were used. These were collected from individuals aged 40-69 years who visited 22 assessment centres across the UK between 2006 and 2010. Self-reported commuting method was operationalised into seven categories, ordered to reflect typical levels of physical exertion. The outcomes assessed were BMI (based on objectively measured weight and height) and percentage body fat. Hypothesised confounders were income, area deprivation, urban or rural residence, education, alcohol intake, smoking, leisure physical activity, recreational walking, occupational physical activity, general health, and limiting illness or disability. We used sex-stratified multivariate linear-regression models. FINDINGS: Final complete case sample sizes were 72 999 men and 83 667 women for the BMI outcome and 72 139 men and 82 788 women for the percentage body fat outcome. Active commuting was significantly and independently associated with reduced BMI and percentage body fat for both sexes, with a graded pattern apparent across the seven commuting categories. In fully adjusted models, compared with their car-only counterparts, mixed public and active transport commuters had significantly lower BMI (men: beta coefficient -1.00 kg/m(2) [95% CI -1.14 to -0.87], p<0.0001; women: -0.67 kg/m(2) [-0.86 to -0.47], p<0.0001), as did cycling or cycling and walking commuters (men: -1.71 kg/m(2) [95% CI -1.86 to -1.56], p<0.0001; women: -1.65 kg/m(2) [-1.92 to -1.38], p<0.0001). Similarly, compared with car-only commuters, mixed public transport and active commuters had significantly lower percentage body fat (men: -1.32% [95% CI -1.53 to -1.12], p<0.0001; women: -1.10% [-1.40 to -0.81], p<0.0001), as did cycling or cycling and walking commuters (men: -2.75% [95% CI -3.03 to -2.48], p<0.0001; women: -3.26% [-3.80 to -2.71], p<0.0001). INTERPRETATION: This study is the first to use UK Biobank data to address the topic of active commuting and obesity and shows robust, independent associations between active commuting and healthier bodyweight and composition. These findings support the case for interventions to promote active travel as a population-level policy response for prevention of obesity in mid-life. FUNDING: UK Medical Research Council.","https://www.ncbi.nlm.nih.gov/pubmed/26995106","10.1016/S2213-8587(16)00053-X"
"Lyall2018bank39-1","L. M. Lyall, C. A. Wyse, N. Graham, A. Ferguson, D. M. Lyall, B. Cullen, C. A. Celis Morales, S. M. Biello, D. Mackay, J. Ward, R. J. Strawbridge, J. M. R. Gill, M. E. S. Bailey, J. P. Pell and D. J. Smith",2018,"Association of disrupted circadian rhythmicity with mood disorders, subjective wellbeing, and cognitive function: a cross-sectional study of 91 105 participants from the UK Biobank","Lancet Psychiatry",5,"6","507-514","RAYYAN-INCLUSION: {""Katie""=>true, ""Benjamin""=>true} | 2labels ukbo RAYYAN-INCLUSION: {""Katie""=>""Included"", ""Benjamin""=>""Included""} | 2labels epi","epi",NA,"29776774","BACKGROUND: Disruption of sleep and circadian rhythmicity is a core feature of mood disorders and might be associated with increased susceptibility to such disorders. Previous studies in this area have used subjective reports of activity and sleep patterns, but the availability of accelerometer-based data from UK Biobank participants permits the derivation and analysis of new, objectively ascertained circadian rhythmicity parameters. We examined associations between objectively assessed circadian rhythmicity and mental health and wellbeing phenotypes, including lifetime history of mood disorder. METHODS: UK residents aged 37-73 years were recruited into the UK Biobank general population cohort from 2006 to 2010. We used data from a subset of participants whose activity levels were recorded by wearing a wrist-worn accelerometer for 7 days. From these data, we derived a circadian relative amplitude variable, which is a measure of the extent to which circadian rhythmicity of rest-activity cycles is disrupted. In the same sample, we examined cross-sectional associations between low relative amplitude and mood disorder, wellbeing, and cognitive variables using a series of regression models. Our final model adjusted for age and season at the time that accelerometry started, sex, ethnic origin, Townsend deprivation score, smoking status, alcohol intake, educational attainment, overall mean acceleration recorded by accelerometry, body-mass index, and a binary measure of childhood trauma. FINDINGS: We included 91 105 participants with accelerometery data collected between 2013 and 2015 in our analyses. A one-quintile reduction in relative amplitude was associated with increased risk of lifetime major depressive disorder (odds ratio [OR] 1.06, 95% CI 1.04-1.08) and lifetime bipolar disorder (1.11, 1.03-1.20), as well as with greater mood instability (1.02, 1.01-1.04), higher neuroticism scores (incident rate ratio 1.01, 1.01-1.02), more subjective loneliness (OR 1.09, 1.07-1.11), lower happiness (0.91, 0.90-0.93), lower health satisfaction (0.90, 0.89-0.91), and slower reaction times (linear regression coefficient 1.75, 1.05-2.45). These associations were independent of demographic, lifestyle, education, and overall activity confounders. INTERPRETATION: Circadian disruption is reliably associated with various adverse mental health and wellbeing outcomes, including major depressive disorder and bipolar disorder. Lower relative amplitude might be linked to increased susceptibility to mood disorders. FUNDING: Lister Institute of Preventive Medicine.","https://www.ncbi.nlm.nih.gov/pubmed/29776774","10.1016/S2215-0366(18)30139-1"
"Flint2016bank06-8","E. Flint, E. Webb and S. Cummins",2016,"Change in commute mode and body-mass index: prospective, longitudinal evidence from UK Biobank","Lancet Public Health",1,"2","e46-e55","RAYYAN-INCLUSION: {""Katie""=>true, ""Benjamin""=>true} | 2labels ukbo RAYYAN-INCLUSION: {""Katie""=>""Included"", ""Benjamin""=>""Included""} | 2labels epi","epi","PMC5341146","28299370","BACKGROUND: Insufficient physical activity is a determinant of obesity and cardiovascular disease. Active travel to work has declined in high-income countries in recent decades. We aimed to determine which socioeconomic and demographic characteristics predicted switching to or from active commuting, whether switching from passive to active commuting (or the reverse) independently predicts change in objectively measured body-mass index (BMI), and to ascertain whether any association is attenuated by socioeconomic, demographic, or behavioural factors. METHODS: This study used longitudinal data from UK Biobank. Baseline data collection occurred at 22 centres between March, 2006, and July, 2010, with a repeat assessment at one centre (Stockport) between August, 2012, and June, 2013, for a subset of these participants. Height and weight were objectively measured at both timepoints. We included individuals present at both timepoints with complete data in the analytic sample. Participants were aged 40-69 years and commuted from home to a workplace on a regular basis at both baseline and follow-up. Two exposures were investigated: transition from car commuting to active or public transport commuting and transition from active or public transport to car commuting. Change in BMI between baseline and repeat assessment was the outcome of interest, assessed with bivariate and multivariate logistic regression models. FINDINGS: 502 656 individuals provided baseline data, with 20 346 participating in the repeat assessment after a median of 4.4 years (IQR 3.7-4.9). 5861 individuals were present at both timepoints and had complete data for all analytic variables. Individuals who transitioned from car commuting at baseline to active or public transportation modes at follow-up had a decrease in BMI of -0.30 kg/m(2) (95% CI -0.47 to -0.13; p=0.0005). Conversely, individuals who transitioned from active commuting at baseline to car commuting at follow-up had a BMI increase of 0.32 kg/m(2) (0.13 to 0.50; p=0.008). These effects were not attenuated by adjustment for hypothesised confounders. Change in household income emerged as a determinant of commute mode transitions. INTERPRETATION: Incorporation of increased levels of physical activity as part of the commute to work could reduce obesity among middle-aged adults in the UK. FUNDING: UK Medical Research Council.","https://www.ncbi.nlm.nih.gov/pubmed/28299370","10.1016/S2468-2667(16)30006-8"
"Elova2017tudy75-0","M. Elovainio, C. Hakulinen, L. Pulkki-Raback, M. Virtanen, K. Josefsson, M. Jokela, J. Vahtera and M. Kivimaki",2017,"Contribution of risk factors to excess mortality in isolated and lonely individuals: an analysis of data from the UK Biobank cohort study","Lancet Public Health",2,"6","e260-e266","RAYYAN-INCLUSION: {""Katie""=>true, ""Benjamin""=>true} | 2labels ukbo RAYYAN-INCLUSION: {""Katie""=>""Included"", ""Benjamin""=>""Included""} | 2labels epi","epi","PMC5463031","28626828","BACKGROUND: The associations of social isolation and loneliness with premature mortality are well known, but the risk factors linking them remain unclear. We sought to identify risk factors that might explain the increased mortality in socially isolated and lonely individuals. METHODS: We used prospective follow-up data from the UK Biobank cohort study to assess self-reported isolation (a three-item scale) and loneliness (two questions). The main outcomes were all-cause and cause-specific mortality. We calculated the percentage of excess risk mediated by risk factors to assess the extent to which the associations of social isolation and loneliness with mortality were attributable to differences between isolated and lonely individuals and others in biological (body-mass index, systolic and diastolic blood pressure, and handgrip strength), behavioural (smoking, alcohol consumption, and physical activity), socioeconomic (education, neighbourhood deprivation, and household income), and psychological (depressive symptoms and cognitive capacity) risk factors. FINDINGS: 466 901 men and women (mean age at baseline 56.5 years [SD 8.1]) were included in the analyses, with a mean follow-up of 6.5 years (SD 0.8). The hazard ratio for all-cause mortality for social isolation compared with no social isolation was 1.73 (95% CI 1.65-1.82) after adjustment for age, sex, ethnic origin, and chronic disease (ie, minimally adjusted), and was 1.26 (95% CI 1.20-1.33) after further adjustment for socioeconomic factors, health-related behaviours, depressive symptoms, biological factors, cognitive performance, and self-rated health (ie, fully adjusted). The minimally adjusted hazard ratio for mortality risk related to loneliness was 1.38 (95% CI 1.30-1.47), which reduced to 0.99 (95% CI 0.93-1.06) after full adjustment for baseline risks. INTERPRETATION: Isolated and lonely people are at increased risk of death. Health policies addressing risk factors such as adverse socioeconomic conditions, unhealthy lifestyle, and lower mental wellbeing might reduce excess mortality among the isolated and the lonely. FUNDING: Academy of Finland, NordForsk, and the UK Medical Research Council.","https://www.ncbi.nlm.nih.gov/pubmed/28626828","10.1016/S2468-2667(17)30075-0"
"Mason2018bank12-8","K. E. Mason, N. Pearce and S. Cummins",2018,"Associations between fast food and physical activity environments and adiposity in mid-life: cross-sectional, observational evidence from UK Biobank","Lancet Public Health",3,"1","E24-E33","RAYYAN-INCLUSION: {""Katie""=>true, ""Benjamin""=>true} | 2labels ukbo RAYYAN-INCLUSION: {""Katie""=>""Included"", ""Benjamin""=>""Included""} | 2labels epi","epi",NA,"WOS:000425591600012","Background The built environment might be associated with development of obesity and related disorders. We examined whether neighbourhood exposure to fast-food outlets and physical activity facilities were associated with adiposity in UK adults.///Methods We used cross-sectional observational data from UK Biobank. Participants were aged 40-70 years and attended 21 assessment centres between 2006 and 2010. Using linked data on environments around each participant's residential address, we examined whether density of physical activity facilities and proximity to fast-food outlets were associated with waist circumference, body-mass index (BMI), and body fat percentage. We used multilevel linear regression models adjusted for potential confounders, and conducted several sensitivity analyses.///Findings Complete case sample sizes were 401 917 (waist circumference models), 401 435 (BMI), and 395 640 (body fat percentage). Greater density of physical activity facilities within 1000 m of home was independently associated with smaller waist circumference and lower BMI and body fat percentage. Compared with people with no nearby facilities, those with at least six facilities close to home had 1.22 cm smaller waist circumference (95% CI-1.64 to -0.80), 0.57 kg/m(2) lower BMI (-0.74 to -0.39), and 0.81 percentage points lower body fat (-1.03 to -0.59). Living further from a fast-food outlet was weakly associated with waist circumference and BMI, mostly among women. Compared with people living fewer than 500 m from a fast-food outlet, those living at least 2000 m away had 0.26 cm smaller waist circumference (-0.52 to 0.01).///Interpretation This study shows strong associations between high densities of physical activity facilities and lower adiposity for adults in mid-life. We observed weaker associations for access to fast food, but these are likely to be underestimated owing to limitations of the food environment measure. Policy makers should consider interventions aimed at tackling the obesogenic built environment.","<Go to ISI>://WOS:000425591600012","10.1016/S2468-2667(17)30212-8"
"Hanlo2018ants91-4","P. Hanlon, B. I. Nicholl, B. D. Jani, D. Lee, R. McQueenie and F. S. Mair",2018,"Frailty and pre-frailty in middle-aged and older adults and its association with multimorbidity and mortality: a prospective analysis of 493 737 UK Biobank participants","Lancet Public Health",3,"7","e323-e332","RAYYAN-INCLUSION: {""Katie""=>true, ""Benjamin""=>true} | 2labels ukbo RAYYAN-INCLUSION: {""Katie""=>""Included"", ""Benjamin""=>""Included""} | 2labels epi","epi","PMC6028743","29908859","BACKGROUND: Frailty is associated with older age and multimorbidity (two or more long-term conditions); however, little is known about its prevalence or effects on mortality in younger populations. This paper aims to examine the association between frailty, multimorbidity, specific long-term conditions, and mortality in a middle-aged and older aged population. METHODS: Data were sourced from the UK Biobank. Frailty phenotype was based on five criteria (weight loss, exhaustion, grip strength, low physical activity, slow walking pace). Participants were deemed frail if they met at least three criteria, pre-frail if they fulfilled one or two criteria, and not frail if no criteria were met. Sociodemographic characteristics and long-term conditions were examined. The outcome was all-cause mortality, which was measured at a median of 7 years follow-up. Multinomial logistic regression compared sociodemographic characteristics and long-term conditions of frail or pre-frail participants with non-frail participants. Cox proportional hazards models examined associations between frailty or pre-frailty and mortality. Results were stratified by age group (37-45, 45-55, 55-65, 65-73 years) and sex, and were adjusted for multimorbidity count, socioeconomic status, body-mass index, smoking status, and alcohol use. FINDINGS: 493 737 participants aged 37-73 years were included in the study, of whom 16 538 (3%) were considered frail, 185 360 (38%) pre-frail, and 291 839 (59%) not frail. Frailty was significantly associated with multimorbidity (prevalence 18% [4435/25 338] in those with four or more long-term conditions; odds ratio [OR] 27.1, 95% CI 25.3-29.1) socioeconomic deprivation, smoking, obesity, and infrequent alcohol consumption. The top five long-term conditions associated with frailty were multiple sclerosis (OR 15.3; 99.75% CI 12.8-18.2); chronic fatigue syndrome (12.9; 11.1-15.0); chronic obstructive pulmonary disease (5.6; 5.2-6.1); connective tissue disease (5.4; 5.0-5.8); and diabetes (5.0; 4.7-5.2). Pre-frailty and frailty were significantly associated with mortality for all age strata in men and women (except in women aged 37-45 years) after adjustment for confounders. INTERPRETATION: Efforts to identify, manage, and prevent frailty should include middle-aged individuals with multimorbidity, in whom frailty is significantly associated with mortality, even after adjustment for number of long-term conditions, sociodemographics, and lifestyle. Research, clinical guidelines, and health-care services must shift focus from single conditions to the requirements of increasingly complex patient populations. FUNDING: CSO Catalyst Grant and National Health Service Research for Scotland Career Research Fellowship.","https://www.ncbi.nlm.nih.gov/pubmed/29908859","10.1016/S2468-2667(18)30091-4"
